[
  {
    "id": "ccarf-concept-1.1",
    "task_statement": "1.1",
    "domain": 1,
    "title": "The Agentic Loop and stop_reason",
    "concept": "An agentic loop repeatedly sends requests to Claude and inspects the API's `stop_reason`. While `stop_reason` is `\"tool_use\"`, the loop executes the requested tools and appends their `tool_result` blocks to the conversation history so the model can reason about the next action; when `stop_reason` is `\"end_turn\"`, the loop terminates and returns the final response. Tool selection is model-driven: Claude decides the next tool from the evolving context rather than following a pre-configured decision tree or fixed sequence.",
    "why_it_matters": "Building control flow on the structured `stop_reason` signal makes agents adaptive and reliable, letting Claude dynamically choose tools instead of being locked into a brittle, hard-coded script.",
    "common_trap": "Terminating the loop by parsing natural-language completion phrases, treating an arbitrary iteration cap as the primary stop, or checking assistant text content as a completion indicator instead of relying on `stop_reason` (`\"end_turn\"`).",
    "lab": "lab-03-agentic-loop",
    "code_samples": [
      {
        "caption": "Agentic loop: branch on stop_reason, not on text",
        "language": "python",
        "code": "while True:\n    resp = client.messages.create(model=MODEL, messages=messages, tools=tools)\n    messages.append({\"role\": \"assistant\", \"content\": resp.content})\n\n    if resp.stop_reason == \"end_turn\":\n        return resp.text          # model is done -> stop on the SIGNAL, not on phrases\n\n    if resp.stop_reason == \"tool_use\":\n        results = []\n        for block in resp.tool_use_blocks():\n            output = run_tool(block.name, block.input)\n            results.append({\"type\": \"tool_result\",\n                            \"tool_use_id\": block.id, \"content\": output})\n        messages.append({\"role\": \"user\", \"content\": results})   # feed back, then iterate"
      }
    ],
    "videos": [
      {
        "title": "Claude Certified Architect: Full Course Ep 01: Agentic Loops & stop_reason Explained",
        "url": "https://www.youtube.com/watch?v=ldqOnljDINc"
      },
      {
        "title": "How We Build Effective Agents: Barry Zhang, Anthropic",
        "url": "https://www.youtube.com/watch?v=D7_ipDqhtwk"
      }
    ]
  },
  {
    "id": "ccarf-concept-1.2",
    "task_statement": "1.2",
    "domain": 1,
    "title": "Coordinator-subagent orchestration in hub-and-spoke multi-agent systems",
    "concept": "A hub-and-spoke multi-agent system centers on a coordinator (the hub) that owns orchestration: it decomposes the query, delegates subtasks to specialized subagents (the spokes), routes all inter-subagent communication and error handling through itself, and aggregates results. Subagents run with isolated context, so they do not inherit the coordinator's history or each other's findings; needed context must be passed explicitly in their prompts. A capable coordinator analyzes query complexity to dynamically select which subagents to invoke instead of always running the full pipeline, partitions research scope across subagents (distinct subtopics or source types) to minimize duplication, and runs iterative refinement loops: evaluate the synthesis output for gaps, re-delegate targeted queries to search and analysis subagents, and re-invoke synthesis until coverage is sufficient.",
    "why_it_matters": "The exam repeatedly tests whether you can locate a failure at the orchestration layer rather than blaming a subagent that executed its assigned scope correctly. Understanding isolated context, centralized routing, dynamic selection, scope partitioning, and refinement loops lets you diagnose coverage gaps, latency, and reliability problems and choose proportionate fixes (e.g., broadening decomposition or adding a scoped tool) instead of over-provisioning agents.",
    "common_trap": "Assuming subagents share memory or that a subagent's success means the overall task succeeded. When a broad report misses whole domains, the cause is usually the coordinator's overly narrow decomposition, not a downstream search, analysis, or synthesis agent that worked correctly within the scope it was given.",
    "lab": "lab-19-multi-agent-orchestration",
    "videos": [
      {
        "title": "Multi-Agent Systems & Coordinator Patterns Explained | Claude Certified Architect Ep 02",
        "url": "https://www.youtube.com/watch?v=ejPWvBcc_DU"
      },
      {
        "title": "Exploring Subagents in Claude Code with Addy Osmani",
        "url": "https://www.youtube.com/watch?v=o-kN3vkZcZ4"
      }
    ]
  },
  {
    "id": "ccarf-concept-1.3",
    "task_statement": "1.3",
    "domain": 1,
    "title": "Subagent invocation, context passing, and spawning",
    "concept": "Coordinators spawn subagents through the Task tool, which requires `\"Task\"` in the coordinator's `allowedTools`. Each subagent type is configured by an `AgentDefinition` (description, system prompt, tool restrictions). Subagents run with ISOLATED context: they do not inherit the coordinator's history or share memory, so all needed context, including complete prior findings, must be provided explicitly in the subagent's prompt, ideally as structured data that separates content from metadata (source URLs, document names, page numbers, dates) to preserve attribution. Parallel subagents are launched by emitting multiple Task calls in a single response; fork-based session management lets you explore divergent approaches from a shared analysis baseline. Coordinator prompts should state goals and quality criteria, not step-by-step procedures.",
    "why_it_matters": "These are the exact mechanics that make multi-agent systems work or fail. Forgetting `\"Task\"` silently disables delegation; assuming context inheritance produces subagents that ignore prior findings; sequential spawning wastes latency that parallel Task calls would recover; and unstructured context passing corrupts citations during synthesis.",
    "common_trap": "Believing subagents automatically inherit the coordinator's conversation or share a common memory. They do not. Referring a subagent to 'the earlier results' passes nothing; the complete findings must be embedded in its prompt.",
    "lab": "lab-19-multi-agent-orchestration",
    "code_samples": [
      {
        "caption": "AgentDefinition: a coordinator needs \"Task\" to delegate",
        "language": "python",
        "code": "coordinator = AgentDefinition(\n    name=\"coordinator\",\n    description=\"Decomposes the query and delegates to specialized subagents.\",\n    system_prompt=\"State goals and quality bars, not a step-by-step procedure.\",\n    allowed_tools=[\"Task\"],          # omit \"Task\" and delegation SILENTLY fails\n)\n# Subagents run with ISOLATED context: they inherit nothing, so every needed\n# finding must be embedded verbatim in the Task prompt (not 'see earlier results')."
      },
      {
        "caption": "Parallel spawn: multiple Task calls in ONE assistant turn",
        "language": "json",
        "code": "{\n  \"role\": \"assistant\",\n  \"content\": [\n    {\"type\": \"tool_use\", \"name\": \"Task\", \"id\": \"toolu_1\",\n     \"input\": {\"subagent_type\": \"web_search\",\n               \"prompt\": \"Research X. (Full context here; you inherit nothing.)\"}},\n    {\"type\": \"tool_use\", \"name\": \"Task\", \"id\": \"toolu_2\",\n     \"input\": {\"subagent_type\": \"doc_analysis\",\n               \"prompt\": \"Analyze Y. Prior findings, verbatim: [...]\"}}\n  ]\n}"
      }
    ],
    "videos": [
      {
        "title": "Claude Certified Architect Ep 03 | Subagent Context Passing & Session Management | Full Course",
        "url": "https://www.youtube.com/watch?v=a2N6vKdQUfE"
      },
      {
        "title": "Claude Certified Architect Ep 04 | Multi-Agent System in Python & Claude SDK | Hands On",
        "url": "https://www.youtube.com/watch?v=e7ijjK173zI"
      }
    ]
  },
  {
    "id": "ccarf-concept-1.4",
    "task_statement": "1.4",
    "domain": 1,
    "title": "Enforcement and handoff patterns in multi-step workflows",
    "concept": "Multi-step agent workflows can order steps two ways. Prompt-based guidance (system-prompt rules, few-shot examples) influences the model probabilistically. Programmatic enforcement (hooks and prerequisite gates) intercepts tool calls and blocks a downstream action until a prerequisite has demonstrably completed—for example, blocking process_refund until get_customer has returned a verified customer ID. Enforcement pairs with two other skills: decomposing multi-concern requests into distinct items investigated in parallel over shared context before a unified resolution, and compiling structured handoff summaries (customer ID, root cause, amount, recommended action) when escalating to humans who lack the transcript.",
    "why_it_matters": "Prompt instructions alone have a non-zero failure rate. When a specific sequence is safety- or money-critical (identity verification before financial operations), that residual failure rate causes misidentified accounts and incorrect refunds. A prerequisite gate converts a probabilistic hope into a deterministic guarantee, which is what compliance-critical business logic requires.",
    "common_trap": "Assuming a sufficiently strong system prompt or enough few-shot examples can guarantee ordering. They reduce but never eliminate the failure rate; only a programmatic gate that blocks the call gives deterministic compliance. A related trap is confusing tool routing (which tools are available) with tool ordering (which must run first)—routing does not enforce sequence.",
    "lab": "lab-11-hooks-and-enforcement",
    "code_samples": [
      {
        "caption": "Prerequisite gate: deterministic ordering a prompt cannot guarantee",
        "language": "python",